{
  "schema_version": 1,
  "project_version": "2.4.0",
  "frp_version": "0.71.0",
  "channel": "development",
  "git_ref": "e43a844c2947526a887fd5e45506fa3c2a0e82bf",
  "owner": "datarelay-labs",
  "repo": "datarelay-link",
  "https_raw_base": "https://raw.githubusercontent.com/datarelay-labs/datarelay-link",
  "signing": false,
  "integrity": {
    "sha256": true,
    "checksum_file": "SHA256SUMS"
  },
  "sbom": {
    "format": "spdx-json",
    "artifact": "dist/sbom.spdx.json",
    "generator": "scripts/generate-sbom.py",
    "verifier": "scripts/verify-sbom.sh",
    "committed": false,
    "available": true,
    "binds_to": "release source commit",
    "deterministic": true,
    "note": "Generated at release time from the checked-out release commit and published as an attested workflow artifact; not tracked in git, because a committed file cannot record the hash of the commit containing it. Excluded from SHA256SUMS: its inventory is built from SHA256SUMS, so checksumming it there would be circular. Deterministic for a fixed commit (SOURCE_DATE_EPOCH or HEAD commit time)."
  },
  "provenance": {
    "type": "github-artifact-attestation",
    "workflow": ".github/workflows/release-attest.yml",
    "available": false,
    "workflow_ready": true,
    "verification": "authoritative",
    "note": "Attestation is produced by the release-attest workflow, which must be dispatched from the immutable release tag. The workflow binds expected tag -> expected commit -> checked-out HEAD -> attested subjects before attesting, and its gh attestation verify step is authoritative: verification failure fails the release-integrity gate. There is no DEFERRED outcome. available=false until a verified attestation exists for the published candidate; workflow_ready=true means the workflow is present and validated in-tree."
  },
  "checksum_file": "SHA256SUMS",
  "supported_frp_versions": {
    "0.71.0": {
      "status": "tested",
      "amd64_sha256": "84f27e39f11169f7adcef8e8b70c9329de17747b1f14dad9fb95eef5682ea716",
      "arm64_sha256": "f33c293c275d8fc68c654b6fba8f10b2551d6463d09a9fc9cffb7227eae82266",
      "darwin_arm64_sha256": "45be02b186860d375ed49a8941ae9569628a54bf14e67fc36b29c98c99dabcc6",
      "windows_amd64_sha256": "9e5062e3e5cf07e67144a3a4acf175ef6a2486f3605dd6cf288bae34ab39819f",
      "websocket_path": "/~!frp"
    }
  },
  "note": "Checksums are integrity hashes from SHA256SUMS, not cryptographic signatures. This manifest describes the v2.4.0 candidate identity with immutable git_ref vPROJECT_VERSION and never mutable main. Dev channel (DRLINK_RELEASE_CHANNEL=dev or FRP_RELEASE_CHANNEL=dev) remains explicit opt-in via main after the tag. Top-level artifacts list official install/uninstall scripts; self-contained bundle manifests are separate and must not self-reference. Integrity (SHA256), SBOM (SPDX JSON), and GitHub Artifact Attestation are distinct evidence classes. Pretags / development trees pin git_ref and source_head to the exact HEAD SHA; never advertise a future stable tag before it exists. features.mcp_included=true after MCP Bridge/AI Access implementation.",
  "supply_chain": {
    "immutable_version_reference": "git tag vPROJECT_VERSION",
    "tag_policy": "Published tags are immutable and are never moved, deleted, recreated, retargeted, or force-pushed. A wrong tag is superseded by a new version tag.",
    "artifact_integrity": "SHA256SUMS verified by project-update before execution",
    "artifact_ordering": "scripts/build-release-artifacts.sh: build bundles -> update SHA256SUMS -> generate SBOM -> verify",
    "excluded_from_sha256sums": [
      "SHA256SUMS",
      "release-manifest.json",
      "dist/sbom.spdx.json"
    ],
    "sbom": "SPDX JSON via scripts/generate-sbom.py, gated by scripts/verify-sbom.sh",
    "provenance": "GitHub Artifact Attestations via .github/workflows/release-attest.yml (OIDC)",
    "version_consistency": "scripts/check-version-consistency.sh, derived from VERSION",
    "distinctions": [
      "checksum != artifact provenance",
      "artifact provenance != commit signature",
      "developer commit signing is not required for this release evidence set"
    ]
  },
  "artifacts": {
    "bootstrap-client.sh": {
      "path": "dist/bootstrap-client.sh",
      "url_path": "dist/bootstrap-client.sh",
      "sha256": "a707990220bc7ff8a3f642938d6e8124217dced2bcfce6906f059dc0f2dc5938"
    },
    "bootstrap-client.ps1": {
      "path": "dist/bootstrap-client.ps1",
      "url_path": "dist/bootstrap-client.ps1",
      "sha256": "1b9194cb5707675d744529dcdf13ed86d7c9fe8bcba9164be537409445b0d533"
    },
    "bootstrap-server.sh": {
      "path": "dist/bootstrap-server.sh",
      "url_path": "dist/bootstrap-server.sh",
      "sha256": "8f19641621bcebe142007c243f1c0dee224a0975edb6f5d7e51678996dcc48c7"
    },
    "uninstall-client.sh": {
      "path": "dist/uninstall-client.sh",
      "url_path": "dist/uninstall-client.sh",
      "sha256": "9bcc69b3ea523effc622550bb95d98e80ee55914f8fb66b42a392554e817e69e"
    },
    "uninstall-server.sh": {
      "path": "dist/uninstall-server.sh",
      "url_path": "dist/uninstall-server.sh",
      "sha256": "e49f8fbf55301fb00ce456cb880fb0e3083e216f7e44404f406e9de8362671c7"
    }
  },
  "source_head": "e43a844c2947526a887fd5e45506fa3c2a0e82bf",
  "features": {
    "mcp_included": true
  },
  "immutable_source_ref": "e43a844c2947526a887fd5e45506fa3c2a0e82bf"
}
